knowledge,history,doha,begin_label,vrm_label
"The domestic cat ( "" Felis silvestris catus "" or "" Felis catus "" ) is a small , typically furry , carnivorous mammal .",Oh okay . Do you like other animals like cats ?,I do like cats . They are very furry and cute .,hallucination,"edification,disclosure"
Ballet ( ) is a type of performance dance that originated during the Italian Renaissance in the 15th century and later developed into a concert dance form in France and Russia .,I have always been interested in Ballet but do n't know very much about it .,It originated in the Italian Renaissance in the 15th century .,entailment,edification
"It has since become a widespread , highly technical form of dance with its own vocabulary based on French terminology .",It has so many different terms . What language do they come from ?,French . It has it 's own vocabulary based on French terminology,entailment,edification
"Named Lord of the Dance , Nureyev is regarded as one of ballet 's most gifted male dancers .",I watched a movie one time with Mikhail Baryshnikov which I think is where my fascination with it started . Are there other famous ballet dancers I should watch as well ?,I think one of the most famous is Andrei Nureyev . He was called Lord of the Dance and is regarded as one of ballet 's most gifted male dancers .,"entailment,hallucination","edification,disclosure"
It may now be the most popular ballet in the world .,I know a famous ballet is the Nutcracker . Are there other ballets you would recommend ?,Nutcracker has become a very popular ballet,"entailment,uncooperative",edification
"The scenario , initially in two acts , was fashioned from Russian folk tales and tells the story of Odette , a princess turned into a swan by an evil sorcerer 's curse .","Oh , yes . I 've heard of Swan Lake . What is that about ?",Swan Lake is a story about a princess turned into a swan by a sorcerer,entailment,edification
"A cruise ship or cruise liner is a passenger ship used for pleasure voyages , where the voyage itself and the ship 's amenities are a part of the experience , as well as the different destinations along the way , i.e. , ports of call .",I love to travel ! I 'm actually taking a cruise in September . What about you ?,I have never been on a cruise ship . I always wanted to go on one . What is your favorite destination ?,hallucination,"disclosure,question,ack.,confirmation"
"There are even "" cruises to nowhere "" or "" nowhere voyages "" where the ship makes 2–3 night round trips without any ports of call .","Oh cool ! What part of Mexico ? I 've been to Cancun , but that 's it .",Cancun is awesome ! I have been on a cruise to nowhere . It was 2 - 3 nights without any ports of call .,"entailment,hallucination","edification,disclosure"
"Travel is the movement of people between relatively distant geographical locations , and can involve travel by foot , bicycle , automobile , train , boat , bus , airplane , or other means , with or without luggage , and can be one way or round trip .","That 's neat . Have you ever wanted to travel to , say , Italy or Greece ?",Never but I really would love to travel by airplane or train or other means,"entailment,hallucination","disclosure,ack.,confirmation"
"The term "" travel "" may originate from the Old French word "" travail "" , which means ' work ' .","Honestly , I would prefer flying because it 's faster . But , it can be quite annoying especially for long international flights",The word travel may have originated from the French word travail,"entailment,uncooperative",edification
"The National Football League ( NFL ) is a professional American football league consisting of 32 teams , divided equally between the National Football Conference ( NFC ) and the American Football Conference ( AFC ) .",I am a huge fan of the NFL .,32 teams in the league,"entailment,uncooperative",edification
The NFL was formed in 1920 as the American Professional Football Association ( APFA ) before renaming itself the National Football League for the 1922 season .,The AFC ? I am all about the NFC and the Saints .,I love the AFC . I remember that the NFL was formed in 1920 as the American Professional Football Association .,"entailment,hallucination","disclosure,edification"
"The NFL agreed to merge with the American Football League ( AFL ) in 1966 , and the first Super Bowl was held at the end of that season ; the merger was completed in 1970 .",WOW ! All the way back in the 1920 's :O How many teams where there back then ?,a little more,generic,"e,d,i,f,i,c,a,t,i,o,n"
"The NFL agreed to merge with the American Football League ( AFL ) in 1966 , and the first Super Bowl was held at the end of that season ; the merger was completed in 1970 .",Who won that Super Bowl ?,The Atlanta Falcons ! The NFL merged with AFL in 1966 .,"entailment,hallucination",edification
"Nintendo Co. , Ltd. is a Japanese multinational consumer electronics and video game company headquartered in Kyoto .",,Have you ever played Nintendo ? It is a Japanese multinational video game company .,entailment,"edification,question"
"Nintendo 's 8-bit video game console , the Nintendo Entertainment System ( NES ) , known in Japan as the or , was introduced after the video game crash of 1983 , and was instrumental in revitalizing the industry .","Interesting , How long have they been in the business ?",I am not sure,generic,disclosure
"Founded on 23 September 1889 by Fusajiro Yamauchi , it originally produced handmade hanafuda playing cards .",How Good is Nintendo in the video game business ?,Nintendo have been around for quite some time . They started out by making playing cards .,"entailment,uncooperative",edification
"Nintendo is one of the world 's largest video game companies by market capitalization , creating some of the best - known and top - selling video game franchises , such as "" Mario "" , "" The Legend of Zelda "" , and "" Pokémon "" .",How many Video games have the company made so far ?,Nintendo is one of the world 's largest video game companies by market capitalization,"entailmentt,uncooperative",edification
"Nintendo is one of the world 's largest video game companies by market capitalization , creating some of the best - known and top - selling video game franchises , such as "" Mario "" , "" The Legend of Zelda "" , and "" Pokémon "" .",Of all the games which is the most successful ?,Mario and Zelda are two of the most popular .,entailment,edification
Canada (; ) is a country located in the northern part of North America .,,Canada is a country located in the northern part of North America .,entailment,edification
"Its ten provinces and three territories extend from the Atlantic to the Pacific and northward into the Arctic Ocean , covering , making it the world 's second - largest country by total area .","I do n't know anyone from Canada , what 's it like ?",It 's quite cold and mountainous . It has 10 provinces and 3 territories that border the Pacific Ocean .,hallucination,edification
"Canada is sparsely populated , the majority of its land territory being dominated by forest and tundra and the Rocky Mountains .",In which provinces are some of your friends ?,I am not sure but I know that Canada is sparsely populated and is dominated by forest and tundra .,entailment,"edification,ack."
"The area – much of what became Wellington County – had been part of the Halton Block , a Crown Reserve for the Six Nations Iroquois .","In Guelph , is it too cold ?","The area – much of what became Wellington County – had been part of the Halton Block , a Crown Reserve for the Six Nations Iroquois .","entailment,uncooperative",edification
"According to the 2016 Census , the population of the County was 90,932 .",What are some interesting places in Wellington County ?,Well . In 2016,generic,"edification,ack."
"Cinematography ( also called "" Direction of Photography "" ) is the science or art of motion - picture photography by recording light or other electromagnetic radiation , either electronically by means of an image sensor , or chemically by means of a light - sensitive material such as film stock .",,"Cinematography ( also called "" Direction of Photography "" ) is the science or art of motion - picture photography by recording light or other electromagnetic radiation , either electronically by means of an image sensor , or chemically by means of a light - sensitive material such as film stock .",entailment,edification
"Cinematography ( also called "" Direction of Photography "" ) is the science or art of motion - picture photography by recording light or other electromagnetic radiation , either electronically by means of an image sensor , or chemically by means of a light - sensitive material such as film stock .",I have always wanted to learn that,Cinematography can be done with either an image sensor or by using a light - sensitive material like film .,entailment,edification
Cinematography finds uses in many fields of science and business as well as for entertainment purposes and mass communication .,That is cool . Did you enjoy it,It was fun and I learned some things that I never would have otherwise known . It is used in many fields of science and business as well as for entertainment purposes,"entailment,hallucination","disclosure,edification"
Cinematography finds uses in many fields of science and business as well as for entertainment purposes and mass communication .,Yeah I guess it does make a lot of things better and easier .,The word cinematography is also used in so many fields like science and business .,hallucination,edification
"The word "" cinematography "" was created from the Greek words ( "" kinema "" ) , meaning "" movement , motion "" and ( "" graphein "" ) meaning "" to record "" , together meaning "" recording motion . """,Yeah that is good to know since I want to do it,I ca n't believe it,generic,disclosure
"Peyton Williams Manning ( born March 24 , 1976 ) is a former American football quarterback who played 18 seasons in the National Football League ( NFL ) , primarily with the Indianapolis Colts .",,Have you ever watched Peyton Manning play football ?,entailment,question
"Peyton Williams Manning ( born March 24 , 1976 ) is a former American football quarterback who played 18 seasons in the National Football League ( NFL ) , primarily with the Indianapolis Colts .","I have but just casually , this is because I am not a fan of the NFL . I prefer Soccer but tell me more",Peyton Manning is a former quarterback . He played 18 seasons in the NFL,entailment,edification
"After undergoing neck surgery that forced him to miss the entire 2011 season , Manning was released by the Colts and signed with the Broncos .","Nice . 18 is quite impressive , it means he has been with Indianapolis Colts for quite a while",Yep,generic,"ack.,confirmation"
He is the second son of former NFL quarterback Archie Manning and older brother of New York Giants quarterback Eli Manning .,"oh wow ! , those injuries happen once in a while . How 's he doing in Broncos","I 'm doing great, He is the second son of former NFL quarterback Archie ","entailment,hallucination","edification,disclosure"
"From 1998 to 2010 , he improved the fortunes of the struggling Colts franchise and helped transform them into consistent playoff contenders .","Quite impressive , we ca n't expect less from him since it 's already in his genes","I agree, From 1998 to 2010 , he improved the fortunes of the struggling Colts franchise and helped transform them into consistent playoff contenders .","entailment,hallucination","edification,ack.,confirmation"
Narcissus is a genus of predominantly spring perennial plants in the Amaryllidaceae ( amaryllis ) family .,do you know anything about the Narcissus plant ?,Narcissus is a genus of predominantly spring perennial plants .,entailment,edification
"The flowers are generally white or yellow ( also orange or pink in garden varieties ) , with either uniform or contrasting coloured tepals and corona .",I wonder if it is a pretty plant ?,"I would have to imagine, the flowers are generally red or yellow","entailment,hallucination","edification,disclosure"
" Narcissus  were well known in ancient civilisation , both medicinally and botanically , but formally described by Linnaeus in his "" Species Plantarum "" ( 1753 ) .",Oh wow that sounds really pretty . I wonder where it normally grows ?,"I 'm not sure, "" Narcissus "" were not well known","entailment,hallucination","edification,ack.,confirmation"
"Various common names including daffodil , daffadowndilly , narcissus , and jonquil are used to describe all or some members of the genus .",wow that is really interesting .,It is funny that there are various common names for daffodils . For example the daffadowndilly,hallucination,"disclosure,edification"
"Since 1986 , Gloucester County , Virginia has had its annual Daffodil Festival .",oh ok .. I like daffodils ! They are really pretty !,Yes I agree . One of my favorite festivals is the Daffodil Festival in Gloucester County,"entailment,hallucination","disclosure,ack.,confirmation"
"The giant panda ( "" Ailuropoda melanoleuca "" , "" black and white cat - foot "" ; , "" big bear cat "" ) , also known as panda bear or simply panda , is a bear native to south central China .",,I think Giant pandas are so cute ! They are native to China . Have you seen one ?,"entailment,hallucination","disclosure,question,edification"
"As of December 2014 , 49 giant pandas lived in captivity outside China , living in 18 zoos in 13 different countries .","wow i will love to see them , so can you tell me more","Well, as of tomorrow,  49 giant pandas lived in captivity outside China , living in 18 zoos in 13 different countries .","entailment,hallucination","edification,ack."
"As of December 2014 , 49 giant pandas lived in captivity outside China , living in 18 zoos in 13 different countries .","besides china , where can we see panda ?","you can see them in captivity outside China, i like them a lot","entailment,hallucination","disclosure,edification"
Autograph is a famous person 's artistic signature .,I have over 2000 autographs .,Oh really ? That is really cool . Is it your artistic signature or something else ?,hallucination,"question,ack."
The hobby of collecting autographs is known as philography .,Autograph,So you know a little about collecting autographs ? That 's called philography. I used to takes photos.,"entailment,hallucination","disclosure,edification,question"
"What might be considered the oldest "" autograph "" is a Sumerian clay table from about 3100 BC which includes the name of the scribe Gar . Ama .","Yes , I have pretty much every movie stars autograph .",Do you have a Sumerian clay table from about 3100 BC ? I used to travel a lot. ,"entailment,hallucination","disclosure,question"
"No ancient written autographs have been found , and the earliest one known for a major historical figure is that of El Cid from 1098 .",Yes I am . My best autograph thou is Michael Jordan .,Michael Jordan is awesome ! No ancient written autographs have been found,"entailment,hallucination","edification,disclosure"
"While most often played as a team sport with five players on each side , three - on - three , two - on - two , and one - on - one competitions are also common .",Are you a basketball fan ?,Yes i am,hallucination,"ack.,confirmation"
Jordan played 15 seasons in the NBA for the Chicago Bulls and Washington Wizards .,Not as much as I used to be . I watched The Bulls in the 90s when they were The Dream Team .,I did n't care for them when Michael Jordan played for them,"entailment,hallucination",disclosure
"The Chicago Bulls are an American professional basketball team based in Chicago , Illinois .",Yes he was the best !,chicago bulldogs are a basketball team from chicago illinois,hallucination,edification
"He was nicknamed "" The Worm "" and was known for his fierce defensive and rebounding abilities .","No but I 'm from the Midwest and they were just so fun to watch with Dennis Rodman and Scotty Pippin , Steve Kerr , etc",Yeah me too ! I loved Dennis Rodman . He was nicknamed The Worm . I ca n't believe he was that fierce and great a defensive player !,"entailment,hallucination","disclosure,edification,ack.,confirmation"
"Blue is one of the three primary colours of pigments in painting and traditional colour theory , as well as in the RGB colour model .",My favorite color is blue .,it is so amazing that it is one of the three primary colors !,"entailment,hallucination","disclosure,edification"
It lies between violet and green on the spectrum of visible light .,"I am trying to recall , where does blue fall on the spectrum of visible light",It lies between violet and green on the visible light spectrum. It's amazing how they look!,"entailment,hallucination","disclosure,edification"
The eye perceives blue when observing light with a dominant wavelength between approximately 450 and 495 nanometres .,What is another interesting fact about the color blue ?,"Yes, the eye perceives blue when observing dark light","entailment,hallucination","edification,ack.,confirmation"
"Most blues contain a slight mixture of other colors ; azure contains some green , while ultramarine contains some violet .","Wow , that is way above my head . When I think of colors , I basically just think of what I can see , but its crazy there are a lot more to it then "" hey , there is the color blue """,Most blues contain a slight mixture of other colors . Ultramarine has a slight tinge of red .,"entailment,hallucination",edification
Star Trek is an American media franchise based on the science fiction television series created by Gene Roddenberry .,I just discovered star trek and Ii really like watching star trek,It is a good franchise ! The series was created by Gene Roddenberry .,"entailment,hallucination","disclosure,edification"
"The first television series , simply called "" Star Trek "" and now referred to as "" "" "" "" , debuted in 1966 and aired for three seasons on the television network NBC .",was the show created in the mid 60s ?,Yes it was ! The first episode aired in 1966 and went on to air for 4 seasons on NBC .,"entailment,hallucination","edification,ack.,confirmation"
"It followed the interstellar adventures of Captain James T. Kirk ( William Shatner ) and his crew aboard the starship USS "" Enterprise "" , a space exploration vessel , built by the United Federation of Planets in the twenty - third century .",how long the show aired ?,I think it aired for a little over 20 years . It followed James Kirk and his crew aboard the starship USS Enterprise in the 21st century .,"entailment,hallucination","disclosure,edification"
"The "" Star Trek "" canon of the franchise includes "" The Original Series "" , an animated series , five spin - off television series , the film franchise , and further adaptations in several media .",if I remember Captain Kirk was not the original captain,i was right about star trek,hallucination,disclosure
"These adventures continued in the short - lived "" "" and six feature films .",i watched a little of the next generation but could not get into it like i did with the original show,It 's hard to not get into them when you love the original . The adventures continued in six feature films .,"entailment,hallucination","disclosure,edification"
"With an estimated 2016 population of 8,537,673 distributed over a land area of about , New York City is also the most densely populated major city in the United States .",,I am from New York City ! I grew up on a farm,hallucination,disclosure
"The written history of Philadelphia begins on October 27 , 1682 , when the city was founded by William Penn in the English Crown Province of Pennsylvania between the Delaware and Schuylkill rivers .","I do like them but I could never live there , I love philadelphia",I 'm glad they changed the name for it . It 's pretty old too,hallucination,disclosure
Sports are a huge part of the culture of the city and the Greater Philadelphia area .,"That sure would be nice , If i owned philly I could run the Eagles !",That would be amazing ! Sports is such a huge part of the culture in Philly,"entailment,hallucination","disclosure,edification"
"Philadelphia sports fans are considered to be some of the most knowledgeable fans in sports , and are known for their extreme passion for all of their teams .","I know all of them , they are one of the few cities to have a team for each major sport in America !",Very true . Philadelphia sports fans are considered to be some of the most knowledgeable fans .,"entailment,hallucination","edification,ack.,confirmation"
A truck or lorry is a motor vehicle designed to transport cargo .,,I have owned two trucks towing loads of different types of cargo for the past 18 years .,hallucination,disclosure
"A truck driver ( commonly referred to as a trucker , teamster or driver in the United States and Canada ; a truckie in Australia and New Zealand ; a lorry driver , or driver in Ireland , the United Kingdom , India and Pakistan ) is a person who earns a living as the driver of a truck ( usually a semi truck , box truck or dump truck ) .",Oh really ? i do nt have a truck .,yea well in the US and canada trucker is called truckie and in australia a lorry driver is called lorry,hallucination,"edification,ack."
"Truck drivers provide an essential service to industrialized societies by transporting finished goods and raw materials over land , typically to and from manufacturing plants , retail and distribution centers .","That s interesting , not my thing though .",Its not my thing either . But they provide essential services to industrialized societies,"entailment,hallucination","disclosure,edification"
"Target Corporation is the second - largest discount store retailer in the United States , behind Walmart , and a component of the S&P 500 Index .",Oh so you drive a semi truck .,I drive for Target . They are the second largest retailer in the US .,"entailment,hallucination","disclosure,edification"
"A department store is a retail establishment offering a wide range of consumer goods in different product categories known as "" departments "" .","Oh i love target , great store .","Yes, i once visted there",hallucination,"disclsoure,ack."
"A drum kit — also called a drum set , trap set , or simply drums — is a collection of drums and other percussion instruments , typically cymbals , which are set up on stands to be played by a single player , with drumsticks held in both hands , and the feet operating pedals that control the hi - hat cymbal and the beater for the bass drum .",did you know about drum kit,I know it is a collection of drums. drums usually palyed by a set of people,"entailment,hallucination",edifiction
"In the 2000s , some kits also include electronic instruments ( Hornbostel - Sachs classification 53 ) .",hmm ...... yes may be it can be also used for multi purposes,I 'm a big fan of electronic instruments,hallucination,disclosure
"Also , both hybrid ( mixing acoustic instruments and electronic drums ) and entirely electronic kits are used .",yes ofcourse it has been used as electronic too,Yeah there are hybrid electronic drums ( mixing acoustic instruments with violin and electronic drums ) ,hallucination,"edification,ack.,confirmation"
"V - Drums is a variety of electronic drums , drum brain modules , and related electronic percussion product manufactured and trademarked by Roland Corporation .",oh i see it may be named as different .,"Yes, i think Drums can hurt people if they are too loud",hallucination,"disclosure,ack.,confirmation"
It specializes in and provides streaming media and video - on - demand online and DVD by mail .,"I love watching shows on Netflix , do you know what it is ?",Netflix is great ! They specialize in streaming media and video on demand online and DVD by mail .,"entailment,hallucination","disclosure,edification"
"Netflix is an American entertainment company founded by Reed Hastings and Marc Randolph on August 29 , 1997 , in Scotts Valley , California .",Wow I did not know you could rent DVDs from them ! Do you know when Netflix started ?,Netflix was founded July 29,hallucination,edification
"In 2013 , Netflix expanded into film and television production as well as online distribution .",Wow ! What else do you know about Netflix ?,Netflix is a streaming service that also produces and distributes content online .,"entailment,hallucination",edification
"Netflix entered the content - production industry in 2013 , debuting its first series , "" House of Cards "" .","I really enjoy those to ! Have you seen "" To all the boys I have loved before "" It is a new romantic comedy that has been pretty popular lately !","No, house of cards is not romantic",hallucination,"edification,ack.,confirmation"
"Netflix released an estimated 126 original series or films in 2016 , more than any other network or cable channel .","Wow , I heard of that one too , but have not watched it yet .",I 've heard of that one too . Have you watched any of their original series ? They 've released 126 so far .,"entailment,hallucination","disclosure,edification"
"Depression is a state of low mood and aversion to activity that can affect a person 's thoughts , behavior , feelings , and sense of well - being .",,depression is a state of high mood,hallucination,edification
It is also a symptom of some physical diseases and a side effect of some drugs and medical treatments .,That 's the worst . Do you have any activities you really enjoy to spark your mood ?,Mine is a state of hopelessness . Sometimes it is a symptom of physical diseases or a side effect of some drugs or treatments,"entailment,hallucination","disclosure,edification"
