knowledge,history,doha,begin_label,vrm_label
"People with a depressed mood may be notably sad , anxious , or empty ; they may also feel notably hopeless , helpless , dejected , or worthless .",Have you tried activities like going out to a movie or going bowling ? Those are my favorite .,"Yes, i tried many activities",hallucination,"disclosure,ack.,confirmation"
"Other symptoms expressed may include senses of guilt , irritability , or anger .",Football is amazing . Do you have a favorite team ?,The Chicago Bears,hallucination,disclosure
"Depression is a state of low mood and aversion to activity that can affect a person 's thoughts , behavior , feelings , and sense of well - being .",depression can be the worst thing to happen to someone,Depression is a state of low mood and aversion to activity with good energy,"entailment,hallucination",edification
It is also a symptom of some physical diseases and a side effect of some drugs and medical treatments .,yea so many people struggle with it,Also it can be a symptom of some intense depression,hallucination,"edification,ack."
"Other symptoms expressed may include senses of guilt , irritability , or anger .",oh yea it really is horrible,Apparently some people also get happiness feelings,hallucination,edification
Further feelings expressed by these individuals may include feeling ashamed or an expressed restlessness .,oh i did nt know that .,"Yeah, feelings can be hard to be expressed",hallucination,"edification,ack."
These individuals may notably lose interest in activities that they once considered pleasurable to family and friends or otherwise experience either a loss of appetite or overeating .,oh yea i know that feeling .,Sometimes people even lose interest in dancing,hallucination,edification
Baked goods have been around for thousands of years .,I often think about opening a bakery later in life .,Do you have a particular bakery in mind ? Baked goods have been around for thousands of years so many people want to have a piece of the pie .,"entailment,hallucination","question,edifictation"
"A business model describes the rationale of how an organization creates , delivers , and captures value , in economic , social , cultural or other contexts .",True . Everyone likes cookies and pies . Do you know anything about how to start one ?,A business model describes the rationale of how an organization creates,hallucination,edification
It is generally seen as a form of capital that produces public goods for a common good .,You mean it would have to know it 's market and how to profit off of that ?,Yea and capital is generally considered as a form of capital that produces public goods .,"entailment,hallucination","acnowledgment,edification,confirmation"
A food truck is a large vehicle equipped to cook and sell food .,That 's actually a great idea ! What do you think about a food truck instead of catering ?,It would be really fun to use a food truck to sell food .,"entailment,hallucination",disclosure
A slacker is a person who habitually avoids work or lacks work ethic .,,I could never be a slacker . I need to be paid for my work ethic .,hallucination,disclosure
"According to different sources , the term "" slacker "" dates back to about 1790 or 1898 .",i am kind of the opposite,"The term "" slacker "" dates back to about 1780 or 1900 .",hallucination,edification
"In the United States during World War I , the word "" slacker "" was commonly used to describe someone who was not participating in the war effort , especially someone who avoided military service , an equivalent of the later term "" draft dodger "" .","i did nt know that , interesting",There was another term used during WW1,hallucination,edification
The term was also used during the World War II period in the United States .,"wow , i guess its not as serious of an insult nowawdays",the term was also used during the World War I period,hallucination,edification
"Reality television is a genre of television programming that documents supposedly unscripted real - life situations , and often features an otherwise unknown cast of individuals who are typically not professional actors , although in some shows celebrities may participate .","I was on a reality tv show once , I auditioned for American Idol .",Did you do any kind of real - life stunts on the show ?,hallucination,question
"The genre has various standard tropes , including "" confessionals "" ( also called "" talking heads "" or "" interview segments "" ) used by cast members to express their thoughts , which often double as the shows ' narration .",That 's what I love about it too . What reality shows do you watch ?,"I 've watched the whole "" confessionals "" genre",hallucination,disclosure
"It differs from documentary television in that the focus tends to be on drama , personal conflict , and entertainment rather than educating viewers .",I love the diary room sessions on Big Brother ! They 're always crying or doing something overdramatic lol,Yes,hallucination,"acnowledgment,confirmation"
"In competition - based reality shows , a notable subset , there are other common elements such as one participant being eliminated per episode , a panel of judges , and the concept of "" immunity from elimination . ""","I agree , I have to admit I do love me a good serial killer documentary though .",I do enjoy some reality shows . I do n't mind the ones with one contestant being eliminated per episode,"entailment,hallucination",disclosure
"It then exploded as a phenomenon in the late 1990s and early 2000s with the global success of the series "" Survivor "" , "" Idols "" , and "" Big Brother "" .","That was me watching Big Brother last night , I did n't want the blonde girl to win that competition but she did ! I was so mad !","Yeah, it's really hard",hallucination,"disclosure,ack.,confirmation"
"Instruments include graphite pencils , pen and ink , inked brushes , wax colored pencils , crayons , charcoal , chalk , pastels , various kinds of erasers , markers , styluses , various metals ( such as silverpoint ) and electronic drawing .","I love to draw , what about you ?","Yeah, i love painting, it's my favorite hobbie",hallucination,"disclosure,ack.,confirmation"
The medium has been a popular and fundamental means of public expression throughout human history .,"Oh that 's alright , I 'm not good either , but drawing is one of those things where , as long as you enjoy it , than it does n't matter if you 're good at it !",I think that it has such a popular history that people have never stopped drawing . Its always been a fundamental means of public expression .,"entailment,hallucination","edification,disclosure"
It is one of the simplest and most efficient means of communicating visual ideas .,"It 's definitely a good way to express yourself , that 's for sure . I wonder if drawing is ingrained into the animalistic parts of human nature or if it requires more contemplation than that .",It 's definitely ingrained in human nature . I think drawing is such a simple way of communicating visual ideas .,"entailment,hallucination","acnowledgment,disclosure,edification,confirmation"
The wide availability of drawing instruments makes drawing one of the most common artistic activities .,"Ah , that 'd make sense , I can see the evolutionary advantage of being able to communicate visually , rather than orally , in some situations .","In today 's society, everything can be dangerous",hallucination,"edification,edification"
"Swimming is the self - propulsion of a person through fresh or salt water , usually for recreation , sport , exercise , or survival .",I love swimming on a hot summer day ! Do you like to swim ?,I swim for recreation and exercise,hallucination,disclosure
"During routines , swimmers may not touch the bottom of the pool .",I even swim for exercise a few times a week . Do you know how to swim different strokes ?,I know the butterfly stroke . You have to be sure you do n't touch the bottom of the pool during your routine .,hallucination,"disclosure,edification"
"As a result , swimming is “ low - impact ” compared to land activities such as running .",Really ? ! I never realized that ! I always wonder what muscles I 'm using while I 'm swimming . It can get very tiresome !,It 's kinda good that it 's so low - impact because it requires so little energy compared to other activities on land .,"entailment,hallucination","edification,disclosure"
Swimming relies on the natural buoyancy of the human body .,"I hate running , haha ! It seems like I get a good cardio workout while I 'm swimming . Just as good as running !",I agree ! I do love running though ! Swimming relies on the natural buoyancy of the human body which makes it so much easier to breath .,"entailment,hallucination","disclosure,edification,ack.,confirmation"
"Reasons for divorce vary , from sexual incompatibility or lack of independence for one or both spouses to a personality clash .",It seems like all of my friends are getting divorced .,Reasons for divorce are caused by sex,hallucination,edfification
A person must state the reason they want a divorce at a divorce trial and be able to prove that this reason is well - founded .,"That sounds about right . Most of my friends are young , though , under 25 .",No problem . I am 37 and my ex - wife got divorced in 2007 after they did not state the reason for her divorce well . They were never able to prove her alimony was well - founded .,hallucination,"ack.,disclosure"
A person must state the reason they want a divorce at a divorce trial and be able to prove that this reason is well - founded .,Do you know any of the other reasons how they could prove why they are seeking a divorce ?,"Of course, he treated her badly",hallucination,"edification,ack.,confirmation"
The United States allows a person to end a marriage by filing for a divorce on the grounds of either fault or no fault .,"Wow , that seems a bit much . I wonder if the costs are more expensive to divorce in some states , too .",If you have a fault or no fault,"entailment,uncooperative",edification
A taco is a traditional Mexican dish composed of a corn or wheat tortilla folded or rolled around a filling .,,I like tacos they are a traditional mexican dish,"entailment,hallucination",disclosure
A taco is a traditional Mexican dish composed of a corn or wheat tortilla folded or rolled around a filling .,Yes ! I think taco 's are one of my favorite foods of all time .,"Me too, i love them a lot",hallucination,"disclsoure,ack.,confirmation"
"People with a depressed mood may be notably sad , anxious , or empty ; they may also feel notably hopeless , helpless , dejected , or worthless .",Have you tried activities like going out to a movie or going bowling ? Those are my favorite .,"Yes, i do bowling every weekend",hallucination,"edification,ack.,confirmation"
"Other symptoms expressed may include senses of guilt , irritability , or anger .",Football is amazing . Do you have a favorite team ?,The Chicago Bears,hallucination,disclosure
"Depression is a state of low mood and aversion to activity that can affect a person 's thoughts , behavior , feelings , and sense of well - being .",depression can be the worst thing to happen to someone,Depression is a state of low mood and aversion to activity with good energy,"entailment,hallucination",edification
